{
  "$schema": "http://json-schema.org/draft-07/schema#",
  "title": "Corkami PE Test Corpus Specification",
  "description": "Machine-readable test specifications extracted from Corkami PE corpus ASM source files. Each entry defines expected values for automated test generation.",
  "version": "1.0.0",
  "corpus_path": "/home/igor/proj/ares/mz-explode/1/pocs/PE/bin/",
  "test_files": [
    {
      "binary_file": "imports.exe",
      "asm_source": "imports.asm",
      "description": "Standard DLL import - Tests basic import directory with multiple DLLs and functions",
      "test_categories": ["import_directory", "basic"],
      "data_directories": {
        "IMPORT": {
          "present": true,
          "dll_count": 2,
          "dlls": [
            {
              "name": "kernel32.dll",
              "name_case_sensitive": false,
              "function_count": 1,
              "functions": [
                {
                  "name": "ExitProcess",
                  "is_ordinal": false,
                  "hint": 0
                }
              ]
            },
            {
              "name": "msvcrt.dll",
              "name_case_sensitive": false,
              "function_count": 1,
              "functions": [
                {
                  "name": "printf",
                  "is_ordinal": false,
                  "hint": 0
                }
              ]
            }
          ]
        }
      },
      "pe_header": {
        "imagebase": "0x400000",
        "section_alignment": "0x1000",
        "file_alignment": "0x200",
        "subsystem": "WINDOWS_CUI"
      }
    },
    {
      "binary_file": "imports_mixed.exe",
      "asm_source": "imports_mixed.asm",
      "description": "Mixed imports - Tests imports by both name and ordinal",
      "test_categories": ["import_directory", "ordinal_imports"],
      "data_directories": {
        "IMPORT": {
          "present": true,
          "dll_count": 2,
          "dlls": [
            {
              "name": "KernEl32",
              "function_count": 1,
              "functions": [
                {
                  "name": "ExitProcess",
                  "is_ordinal": false
                }
              ]
            },
            {
              "name": "mSVCrT",
              "function_count": 1,
              "functions": [
                {
                  "name": "printf",
                  "is_ordinal": false
                }
              ]
            }
          ]
        }
      }
    },
    {
      "binary_file": "impbyord.exe",
      "asm_source": "impbyord.asm",
      "description": "Import by ordinal - Tests ordinal-only imports and self-import",
      "test_categories": ["import_directory", "ordinal_imports", "self_import"],
      "data_directories": {
        "IMPORT": {
          "present": true,
          "dll_count": 2,
          "dlls": [
            {
              "name": "msvcrt.dll",
              "function_count": 1,
              "functions": [
                {
                  "name": "printf",
                  "is_ordinal": false
                }
              ]
            },
            {
              "name": "impbyord.exe",
              "function_count": 1,
              "functions": [
                {
                  "name": null,
                  "is_ordinal": true,
                  "ordinal": 35,
                  "comment": "Self-import by ordinal"
                }
              ]
            }
          ]
        }
      }
    },
    {
      "binary_file": "tls.exe",
      "asm_source": "tls.asm",
      "description": "Simple TLS - Tests Thread Local Storage with callbacks",
      "test_categories": ["tls_directory", "basic"],
      "data_directories": {
        "IMPORT": {
          "present": true,
          "dll_count": 2,
          "dlls": [
            {"name": "kernel32.dll", "function_count": 1},
            {"name": "msvcrt.dll", "function_count": 1}
          ]
        },
        "TLS": {
          "present": true,
          "callback_count": 1,
          "tls_index": "0x012345",
          "address_of_index_nonzero": true,
          "address_of_callbacks_nonzero": true,
          "comment": "Displays twice under XP, once under W7"
        }
      }
    },
    {
      "binary_file": "tls64.exe",
      "asm_source": "tls64.asm",
      "description": "TLS 64-bit - Tests TLS in PE32+ (64-bit)",
      "test_categories": ["tls_directory", "pe32plus"],
      "data_directories": {
        "TLS": {
          "present": true,
          "callback_count": 1
        }
      },
      "pe_header": {
        "is_64bit": true,
        "magic": "0x20B"
      }
    },
    {
      "binary_file": "tls_aoi.exe",
      "asm_source": "tls_aoi.asm",
      "description": "TLS AOI - Tests TLS with AddressOfIndex",
      "test_categories": ["tls_directory", "edge_case"],
      "data_directories": {
        "TLS": {
          "present": true,
          "has_callbacks": true
        }
      }
    },
    {
      "binary_file": "debug.exe",
      "asm_source": "debug.asm",
      "description": "Debug directory - Tests CodeView debug information",
      "test_categories": ["debug_directory", "codeview"],
      "data_directories": {
        "IMPORT": {
          "present": true,
          "dll_count": 3,
          "dlls": [
            {"name": "kernel32.dll"},
            {"name": "msvcrt.dll"},
            {"name": "dbghelp.dll"}
          ]
        },
        "DEBUG": {
          "present": true,
          "entry_count": 1,
          "entries": [
            {
              "type": "CODEVIEW",
              "type_value": 2,
              "size_of_data": 40,
              "codeview": {
                "signature": "RSDS",
                "guid": "00000000-0000-0000-0000-000000000000",
                "age": 96,
                "age_hex": "0x60",
                "pdb_path": "nosymbols.pdb"
              }
            }
          ]
        }
      },
      "pe_header": {
        "characteristics": {
          "DEBUG_STRIPPED": true,
          "flags": ["0x200", "0x0E"]
        }
      }
    },
    {
      "binary_file": "signature.exe",
      "asm_source": "signature.asm",
      "description": "Authenticode signature - Tests security/certificate directory",
      "test_categories": ["security_directory", "authenticode"],
      "data_directories": {
        "IMPORT": {
          "present": true,
          "dll_count": 2
        },
        "SECURITY": {
          "present": true,
          "certificate_count": 1,
          "certificates": [
            {
              "revision": "REVISION_2_0",
              "type": "PKCS_SIGNED_DATA",
              "type_value": 2,
              "data_size": 2168,
              "is_authenticode": true,
              "comment": "Intentionally invalid signature for parser testing"
            }
          ]
        }
      },
      "pe_header": {
        "linker_version": {
          "major": 3,
          "comment": "Required for signature compatibility"
        }
      }
    },
    {
      "binary_file": "dll.dll",
      "asm_source": "dll.asm",
      "description": "DLL with exports - Tests export directory and DLL characteristics",
      "test_categories": ["export_directory", "dll", "relocations"],
      "data_directories": {
        "IMPORT": {
          "present": true,
          "dll_count": 1,
          "dlls": [
            {"name": "msvcrt.dll", "function_count": 1}
          ]
        },
        "EXPORT": {
          "present": true,
          "module_name": "dll.dll",
          "export_count": 1,
          "exports": [
            {
              "name": "export",
              "ordinal": 1,
              "has_name": true,
              "is_forwarder": false
            }
          ]
        },
        "BASERELOC": {
          "present": true,
          "block_count": 1,
          "total_relocations": 5,
          "relocation_type": "HIGHLOW"
        }
      },
      "pe_header": {
        "is_dll": true,
        "characteristics": {
          "DLL": true
        }
      }
    },
    {
      "binary_file": "dllord.dll",
      "asm_source": "dllord.asm",
      "description": "DLL with ordinal exports - Tests exports by ordinal only",
      "test_categories": ["export_directory", "ordinal_exports"],
      "data_directories": {
        "EXPORT": {
          "present": true,
          "export_count": 1,
          "exports": [
            {
              "name": null,
              "ordinal": 1,
              "has_name": false,
              "comment": "Export by ordinal only"
            }
          ]
        }
      }
    },
    {
      "binary_file": "dotnet20.exe",
      "asm_source": "dotnet20.asm",
      "description": ".NET 2.0 assembly - Tests CLR/COM descriptor",
      "test_categories": ["com_descriptor", "dotnet", "resources"],
      "data_directories": {
        "IMPORT": {
          "present": true,
          "dll_count": 1,
          "dlls": [
            {
              "name": "mscoree.dll",
              "function_count": 1,
              "functions": [
                {"name": "_CorExeMain"}
              ]
            }
          ]
        },
        "COM_DESCRIPTOR": {
          "present": true,
          "is_valid": true,
          "runtime_version": "2.5",
          "major_version": 2,
          "minor_version": 5,
          "metadata_rva_nonzero": true,
          "metadata_size_nonzero": true,
          "flags": {
            "ILONLY": true
          },
          "metadata": {
            "signature": "BSJB",
            "streams": ["#~", "#Strings", "#US", "#GUID", "#Blob"],
            "assembly_name": "hw.exe",
            "module_name": "hw.exe"
          }
        },
        "RESOURCE": {
          "present": true,
          "comment": "Version information resources"
        },
        "BASERELOC": {
          "present": true
        }
      },
      "pe_header": {
        "section_count": 3,